{"capabilities":{"flat_ground":true,"portals":true,"presentation_profiles":["code_only_2d"]},"coordinate_frame":{"id":"plan_xz_q48/1","pixels_per_cell":48,"q_per_cell":48},"digests":{"presentation_sha256":"8f26251800437a18df71b9460e705dc0bdff0e95d216a5924a682fd4ab5db9cb","semantic_sha256":"b266d2094af25691ae1a1f36914eb65c167663cc188050a75d3ddcb4d91da93c"},"presentation":{"pixels_per_cell":48,"profile":"code_only_2d","style_ref":"inland_village/1"},"provenance":{"build_stages":[{"operator_id":"worldgen.fixture_source/1","output_port":"semantic","sha256":"b266d2094af25691ae1a1f36914eb65c167663cc188050a75d3ddcb4d91da93c","stage_id":"source"},{"operator_id":"worldgen.fixture_source/1","output_port":"presentation","sha256":"8f26251800437a18df71b9460e705dc0bdff0e95d216a5924a682fd4ab5db9cb","stage_id":"source"}],"recipe_schema":"worldgen.recipe/1","recipe_sha256":"4cbf2d772a337e71713ad59f24cd1012c3ee3bd4e11a70974da9e60c060fd7aa","source_revision":1},"schema":"WorldPackage/1","semantic":{"buildings":[{"id":"home_a","shape":"rectangle"},{"id":"cafe","shape":"L"}],"design_note":"The shared kernel recipe fixture exercises non-coastal profile separation.","extent_cells":[64,48],"kind":"inland_neighborhood","status":"recipe_fixture"},"world_id":"inland_neighborhood_s0"}