{"capabilities":{"flat_ground":true,"portals":true,"presentation_profiles":["code_only_2d"]},"coordinate_frame":{"id":"plan_xz_q48/1","pixels_per_cell":48,"q_per_cell":48},"digests":{"presentation_sha256":"aa40b7ba9db16d95aa93ac4d71efe38666ccce59595787aea217968b665aca17","semantic_sha256":"ac9106184941b05c826204adf9d02dd681375c59e96ce80db91bb7f9c88c6fa1"},"presentation":{"pixels_per_cell":48,"profile":"code_only_2d","roof_profile":"flat_parapet/1","style_ref":"promenade_cafe/1"},"provenance":{"build_stages":[{"operation_count":13,"operator_id":"worldgen.interior_program/1","output_port":"semantic","sha256":"ac9106184941b05c826204adf9d02dd681375c59e96ce80db91bb7f9c88c6fa1","stage_id":"cafe_program"},{"operation_count":13,"operator_id":"worldgen.interior_program/1","output_port":"presentation","sha256":"aa40b7ba9db16d95aa93ac4d71efe38666ccce59595787aea217968b665aca17","stage_id":"cafe_program"}],"recipe_schema":"worldgen.recipe/1","recipe_sha256":"df7c6cf41ea78d4088bd38edd7767cc3cef86161978db29c96cd30dfb5ae7e72","source_revision":1},"schema":"WorldPackage/1","semantic":{"access_profiles":{"public":["public"],"staff":["public","prep","storage"]},"affordances":[{"access":"public","action_type":"sit","approach":[2,3],"capacity":1,"id":"cafe_s0/seat_01","portal_path":["cafe_s0/entry"],"position":[2,2],"room_id":"public","route":[[6,0],[2,0],[2,3]]},{"access":"public","action_type":"sit","approach":[5,3],"capacity":1,"id":"cafe_s0/seat_02","portal_path":["cafe_s0/entry"],"position":[5,2],"room_id":"public","route":[[6,0],[5,0],[5,3]]},{"access":"public","action_type":"sit","approach":[8,3],"capacity":1,"id":"cafe_s0/seat_03","portal_path":["cafe_s0/entry"],"position":[8,2],"room_id":"public","route":[[6,0],[8,0],[8,3]]},{"access":"public","action_type":"sit","approach":[2,5],"capacity":1,"id":"cafe_s0/seat_04","portal_path":["cafe_s0/entry"],"position":[2,4],"room_id":"public","route":[[6,0],[2,0],[2,5]]},{"access":"public","action_type":"buy_food","approach":[10,5],"capacity":1,"id":"cafe_s0/counter","portal_path":["cafe_s0/entry"],"position":[10,6],"room_id":"public","route":[[6,0],[10,0],[10,5]]},{"access":"staff","action_type":"work","approach":[2,9],"capacity":1,"id":"cafe_s0/staff_01","portal_path":["cafe_s0/staff_entry"],"position":[2,10],"room_id":"prep","route":[[0,12],[2,12],[2,9]]}],"building_id":"cafe_s0","capacity":{"seating":4,"service":1,"staff_stations":1},"extent_cells":[12,16],"kind":"standalone_interior","portals":[{"access":"public","from":[6,-1],"from_room":"exterior","id":"cafe_s0/entry","kind":"exterior","to":[6,0],"to_room":"public","width_q":72},{"access":"staff","from":[-1,12],"from_room":"exterior","id":"cafe_s0/staff_entry","kind":"exterior","to":[0,12],"to_room":"prep","width_q":72},{"access":"staff","from":[3,7],"from_room":"public","id":"cafe_s0/public_to_prep","kind":"internal","to":[3,8],"to_room":"prep","width_q":72},{"access":"staff","from":[5,12],"from_room":"prep","id":"cafe_s0/prep_to_storage","kind":"internal","to":[6,12],"to_room":"storage","width_q":72}],"q_per_cell":48,"room_routes":{"public":{"exterior":[],"public":["cafe_s0/entry"]},"staff":{"exterior":[],"prep":["cafe_s0/staff_entry"],"public":["cafe_s0/entry"],"storage":["cafe_s0/staff_entry","cafe_s0/prep_to_storage"]}},"rooms":[{"access":"public","bounds":[0,0,12,8],"id":"public","role":"public_hall"},{"access":"staff","bounds":[0,8,6,8],"id":"prep","role":"prep"},{"access":"staff","bounds":[6,8,6,8],"id":"storage","role":"storage"}],"search_operations":13},"world_id":"standalone_cafe_s0"}
