{"capabilities":{"flat_ground":true,"portals":true,"presentation_profiles":["code_only_2d"]},"coordinate_frame":{"id":"plan_xz_q48/1","pixels_per_cell":48,"q_per_cell":48},"digests":{"presentation_sha256":"8e64815204e965e624d5f3e69026be4ff1cf059ba4338f2988221a14aef1a373","semantic_sha256":"fdcb36c5b8c4c7af7ee5582a7cea12c31558ecd61a92406ece9513b80cbf3ce1"},"presentation":{"pixels_per_cell":48,"profile":"code_only_2d","style_ref":"promenade_cafe/1"},"provenance":{"build_stages":[{"operator_id":"worldgen.fixture_source/1","output_port":"semantic","sha256":"fdcb36c5b8c4c7af7ee5582a7cea12c31558ecd61a92406ece9513b80cbf3ce1","stage_id":"source"},{"operator_id":"worldgen.fixture_source/1","output_port":"presentation","sha256":"8e64815204e965e624d5f3e69026be4ff1cf059ba4338f2988221a14aef1a373","stage_id":"source"}],"recipe_schema":"worldgen.recipe/1","recipe_sha256":"f31bb9a38ab580d1d9f20dbd6b44fe3e7778e51e7a87359f3d1bcc5997931e77","source_revision":1},"schema":"WorldPackage/1","semantic":{"building_id":"cafe","design_note":"The shared interior recipe accepts a bounded massing and program.","extent_cells":[12,16],"kind":"standalone_interior","program":["public_hall","service_counter","prep_storage","seating_x4"],"status":"recipe_fixture"},"world_id":"standalone_cafe_s0"}