{"capabilities":{"flat_ground":true,"portals":true,"presentation_profiles":["code_only_2d"]},"coordinate_frame":{"id":"plan_xz_q48/1","pixels_per_cell":48,"q_per_cell":48},"digests":{"presentation_sha256":"2967a5e8ba608254fc993b27b9f090fe401d9a74ca7125a4bd740ffe36f0f93e","semantic_sha256":"541366a83efc2a22d36480495bb6a61c6db508a57edfa9a4b429e0965e6d785e"},"presentation":{"pixels_per_cell":48,"profile":"code_only_2d","style_ref":"warm_bay/1"},"provenance":{"build_stages":[{"operator_id":"worldgen.fixture_source/1","output_port":"semantic","sha256":"541366a83efc2a22d36480495bb6a61c6db508a57edfa9a4b429e0965e6d785e","stage_id":"source"},{"operator_id":"worldgen.fixture_source/1","output_port":"presentation","sha256":"2967a5e8ba608254fc993b27b9f090fe401d9a74ca7125a4bd740ffe36f0f93e","stage_id":"source"}],"recipe_schema":"worldgen.recipe/1","recipe_sha256":"044b369c2ae2fda24603428086a19ff89903ec61269b18082610d00362ea403c","source_revision":1},"schema":"WorldPackage/1","semantic":{"design_building_count":14,"extent_cells":[128,128],"kind":"coastal_neighborhood","profiles":{"physical_geo_ref":"warm_bay_s1/1","water_policy_ref":"F0_frozen_walkability/1"},"source_package":"res://coastal/warm_bay_s1/export/package.json","source_spec":"res://coastal/warm_bay_s1/town.spec.json"},"world_id":"warm_bay_s1"}