{"capabilities":{"flat_ground":true,"portals":true,"presentation_profiles":["code_only_2d"]},"coordinate_frame":{"id":"plan_xz_q48/1","pixels_per_cell":48,"q_per_cell":48},"digests":{"presentation_sha256":"5da278f3977c9a06fca7391a3fccce651a810511901b480978622dd4a7e8f152","semantic_sha256":"6c2d0a36a5bbd54ba4e9d6db7df79030bf198256ff84a2d0f79644683283e2bb"},"presentation":{"district_ref":"inland_residential/1","pixels_per_cell":48,"profile":"code_only_2d","style_ref":"inland_village/1","visual_seed":1729},"provenance":{"build_stages":[{"operation_count":7,"operator_id":"worldgen.inland_layout/1","output_port":"semantic","sha256":"6c2d0a36a5bbd54ba4e9d6db7df79030bf198256ff84a2d0f79644683283e2bb","stage_id":"layout"},{"operation_count":7,"operator_id":"worldgen.inland_layout/1","output_port":"presentation","sha256":"5da278f3977c9a06fca7391a3fccce651a810511901b480978622dd4a7e8f152","stage_id":"layout"}],"recipe_schema":"worldgen.recipe/1","recipe_sha256":"4fd901a914b19b7e8ef0f7c4b50aa97933117b6ba781db35c2556b09aedbc026","source_revision":1},"schema":"WorldPackage/1","semantic":{"buildings":[{"box":[4,4,10,8],"entry":{"access":"public","position":[9,12],"street_id":"street/main"},"id":"cafe","parcel_id":"parcel/cafe","program":"cafe","rooms_required":["public","prep","storage"],"shape":"rectangle"},{"box":[4,28,8,8],"entry":{"access":"public","position":[8,27],"street_id":"street/main"},"id":"grocery","parcel_id":"parcel/grocery","program":"grocery","rooms_required":["public","stock"],"shape":"rectangle"},{"box":[16,28,8,8],"entry":{"access":"public","position":[20,27],"street_id":"street/main"},"id":"home_a","parcel_id":"parcel/home_a","program":"home","rooms_required":["common","sleeping"],"shape":"rectangle"},{"box":[18,4,8,8],"entry":{"access":"public","position":[22,12],"street_id":"street/main"},"id":"home_b","parcel_id":"parcel/home_b","program":"home","rooms_required":["common","sleeping"],"shape":"rectangle"},{"box":[28,28,8,8],"entry":{"access":"public","position":[32,27],"street_id":"street/main"},"id":"library","parcel_id":"parcel/library","program":"library","rooms_required":["public","reading"],"shape":"rectangle"},{"box":[30,4,10,8],"entry":{"access":"public","position":[35,12],"street_id":"street/main"},"id":"workshop","parcel_id":"parcel/workshop","program":"workshop","rooms_required":["work","storage"],"shape":"rectangle"}],"extent_cells":[64,48],"kind":"inland_neighborhood","parcels":[{"bounds":[2,2,14,12],"building_id":"cafe","id":"parcel/cafe","street_id":"street/main"},{"bounds":[2,26,12,12],"building_id":"grocery","id":"parcel/grocery","street_id":"street/main"},{"bounds":[14,26,12,12],"building_id":"home_a","id":"parcel/home_a","street_id":"street/main"},{"bounds":[16,2,12,12],"building_id":"home_b","id":"parcel/home_b","street_id":"street/main"},{"bounds":[26,26,12,12],"building_id":"library","id":"parcel/library","street_id":"street/main"},{"bounds":[28,2,14,12],"building_id":"workshop","id":"parcel/workshop","street_id":"street/main"}],"q_per_cell":48,"street_graph":{"edges":[{"from":"entry/cafe","id":"street/entry/cafe","role":"public_access","to":"junction/cafe","width_cells":2},{"from":"entry/grocery","id":"street/entry/grocery","role":"public_access","to":"junction/grocery","width_cells":2},{"from":"entry/home_a","id":"street/entry/home_a","role":"public_access","to":"junction/home_a","width_cells":2},{"from":"entry/home_b","id":"street/entry/home_b","role":"public_access","to":"junction/home_b","width_cells":2},{"from":"entry/library","id":"street/entry/library","role":"public_access","to":"junction/library","width_cells":2},{"from":"entry/workshop","id":"street/entry/workshop","role":"public_access","to":"junction/workshop","width_cells":2},{"from":"street/west","id":"street/main/00","role":"public_street","to":"junction/grocery","width_cells":4},{"from":"junction/grocery","id":"street/main/01","role":"public_street","to":"junction/cafe","width_cells":4},{"from":"junction/cafe","id":"street/main/02","role":"public_street","to":"junction/home_a","width_cells":4},{"from":"junction/home_a","id":"street/main/03","role":"public_street","to":"junction/home_b","width_cells":4},{"from":"junction/home_b","id":"street/main/04","role":"public_street","to":"junction/library","width_cells":4},{"from":"junction/library","id":"street/main/05","role":"public_street","to":"junction/workshop","width_cells":4},{"from":"junction/workshop","id":"street/main/06","role":"public_street","to":"street/east","width_cells":4}],"nodes":[{"at":[0,24],"id":"street/west"},{"at":[64,24],"id":"street/east"},{"at":[9,12],"id":"entry/cafe"},{"at":[9,24],"id":"junction/cafe"},{"at":[8,27],"id":"entry/grocery"},{"at":[8,24],"id":"junction/grocery"},{"at":[20,27],"id":"entry/home_a"},{"at":[20,24],"id":"junction/home_a"},{"at":[22,12],"id":"entry/home_b"},{"at":[22,24],"id":"junction/home_b"},{"at":[32,27],"id":"entry/library"},{"at":[32,24],"id":"junction/library"},{"at":[35,12],"id":"entry/workshop"},{"at":[35,24],"id":"junction/workshop"}]},"validation":{"bounds_checked":true,"overlap_policy":"separated_by_declared_side_setbacks","search_operations":7}},"world_id":"inland_neighborhood_s0"}